,Encoding
1423,"Sustainable Business Strategy  JMSB Management MANA 668 600 Master Case based pedagogy, hands-on experience using developing relevant tools practices, often directly Montreal-based organizations"
1424,ENTREPRENEURSHIP THROUGH ACQUISITION  JMSB Management MANA 684 600 Master Students evaluate opportunities acquire firms alternative strategies successfully acquire manage firms.
1425,"Introduction to Modern Standard Arabic II MARA 206 = MARA 207 FAS Classics, Modern Languages and Linguistics MARA 206 200 Bachelor lab work"
1426,"Introduction to Modern Standard Arabic II  FAS Classics, Modern Languages and Linguistics MARA 206 200 Bachelor lab work"
1427,"Intermediate Modern Standard Arabic I  FAS Classics, Modern Languages and Linguistics MARA 240 200 Bachelor lab work"
1428,"Introduction to Modern Standard Arabic I  FAS Classics, Modern Languages and Linguistics MARA 200 200 Bachelor lab work"
1429,"Modern Standard Arabic for Heritage Speakers I  FAS Classics, Modern Languages and Linguistics MARA 203 200 Bachelor lab work"
1430,"Modern Standard Arabic for Heritage Speakers II MARA 206 = MARA 207 FAS Classics, Modern Languages and Linguistics MARA 207 200 Bachelor lab work"
1431,"Modern Standard Arabic for Heritage Speakers II  FAS Classics, Modern Languages and Linguistics MARA 207 200 Bachelor lab work"
1432,"Intermediate Modern Standard Arabic II  FAS Classics, Modern Languages and Linguistics MARA 250 200 Bachelor lab work"
1433,Marketing Management II  JMSB Marketing MARK 301 300 Bachelor Active application theory case studies
1434,"Consumer Behaviour MARK 352 = MARK 405 JMSB Marketing MARK 305 300 Bachelor This course analyzes motivations, roles, behaviour consumers, affected economic, social, cultural influences, marketer may model behaviour decision-making purposes."
1435,"Marketing of Services  JMSB Marketing MARK 451 400 Bachelor The whole spectrum covered, including active application theory, high degree realism, facilitated reflection, identification skills, connection life graduation, case studies, real-world projects/assignments."
1436,e-Marketing MARK 452 = MARK 491A JMSB Marketing MARK 452 400 Bachelor This course offers introduction e-marketing strategies tools required effective marketing via electronic media.
1437,Marketing Communications  JMSB Marketing MARK 453 400 Bachelor Cases role-playing
1438,"Personal Selling  JMSB Marketing MARK 454 400 Bachelor Real world project, sales presentations, role playing, social style simulation, reflective writing"
1439,Marketing Channels  JMSB Marketing MARK 457 400 Bachelor This course focuses different ways organizations make goods services available consumption: inter-organizational system makes channels distribution.
1440,"(also listed as IBUS 462) Environment of World Business IBUS 462 = MARK 462 JMSB Marketing MARK 462 400 Bachelor This foundation course international business; objective present information exposes student cultural, social, political, economic, legal, financial environments Canadian business executives manage operations abroad."
1441,Retailing  JMSB Marketing MARK 463 400 Bachelor Includes project students create innovative retail product/service also serves social cause
1442,"(also listed as IBUS 465) International Marketing Management IBUS 465 = MARK 465 JMSB Marketing MARK 465 400 Bachelor This course studies management approach international marketing, emphasis key variables controllable international marketing manager."
1443,"Business-to-Business Marketing  JMSB Marketing MARK 485 400 Bachelor The whole spectrum covered, including active application theory, high degree realism, facilitated reflection, identification skills, connection life graduation, case studies, real-world projects/assignments."
1444,"Product Strategy and Innovation  JMSB Marketing MARK 486 400 Bachelor Real world project, workshops, case studies, product pitches, reflective writing"
1445,SPECIAL TOPICS SEMINAR  JMSB Marketing MARK 491 400 Bachelor This course focuses issues current potential concern marketers.
1446,CROSS-CULTURAL COMMUN & MGMT  JMSB Marketing MARK 492 400 Bachelor This course deals multicultural dimensions international business operations. The objective develop Canadian managerial skills effective performance international setting.
1447,Strategic Marketing Planning MARK 490 = MARK 495 JMSB Marketing MARK 495 400 Bachelor Capstone course computer-based marketing strategy simulation cases
1448,"CONSUMER BEHAVIOR  JMSB Marketing MARK 671 600 Master This course introduces frameworks, tools, concepts relevant consumption goods services. The focus understanding consumer behaviour order develop execute effective marketing strategies."
1449,Critical Issues in Marketing  JMSB Marketing MARK 493 400 Bachelor This course focuses issues current potential concern marketers.
1450,"The Marketing of Food  JMSB Marketing MARK 458 400 Bachelor Real world project managed capstone project involving real client organizations agri-food; 5 9 guest speakers industry, discussing real recent projects agri-food marketing; 1 2 case studies term; industry-focused weekly readings."
1451,SPORTS MARKETING  JMSB Marketing MARK 444 400 Bachelor The overall objective course familiarize students keys success facet sports marketing. It covers aspects marketing management process particular context sports marketing allocates attention two major aspects: marketing sports marketing sports.
1452,"Mathematics with Computer Algebra  FAS Mathematics and Statistics MAST 232 200 Bachelor Interactive, computer laboratory"
1453,Applied Statistics MAST333 = MATH243 FAS Mathematics and Statistics MAST 333 300 Bachelor Use statistical software
1454,Applied Statistics  FAS Mathematics and Statistics MAST 333 300 Bachelor Use statistical software
1455,TIME SERIES  FAS Mathematics and Statistics MAST 677 600 Master Computer analysis time series using computer packages
1456,"TOPICS IN MATH & STATS MACF301 = FINA385 FAS Mathematics and Statistics MAST 397 300 Bachelor Python programming, analysis real data related sports projects"
1457,"TOPICS IN MATH & STATS  FAS Mathematics and Statistics MAST 397 300 Bachelor Python programming, analysis real data related sports projects"
1458,Introduction to Optimization MAST224 = MATH231 = MATH361 FAS Mathematics and Statistics MAST 324 300 Bachelor Use computing software
1459,Introduction to Optimization  FAS Mathematics and Statistics MAST 324 300 Bachelor Use computing software
1460,SEMINAR IN SPECIAL TOPICS  JMSB Management MBA 695 600 Master The subject matter course vary term term.
1461,Financial Reporting for Responsible Decision Making MBA  642 = MBA 607 JMSB Management MBA 642 600 Master Case analysis
1462,Marketing Management MBA 644 = MBA 610 JMSB Management MBA 644 600 Master Case discussions application-oriented readings
1463,Economic Analysis for Organizational Decision Making MBA 645 = MBA 618 JMSB Management MBA 645 600 Master Cases projects
1464,"Managing People in Organizations MBA 647 = MBA 609 JMSB Management MBA 647 600 Master This course informs students core concepts help explain predict people behave organizations, including discussions perception, motivation, team dynamics, conflict, stress management, leadership, change."
1465,Strategic Managerial Accounting and Control MBA 649 = MBA 628 JMSB Management MBA 649 600 Master Case analysis
1466,Crafting and Implementing Successful Strategies MBA 650 = MBA 622 JMSB Management MBA 650 600 Master Cases projects
1467,"Reading Course  JMSB Management MBA 654 600 Master Case-based research analysis, often working directly organizations studied"
1468,International Case Competition - Executive Assistant  JMSB Management MBA 657 600 Master Case Competition
1469,Van Berkom Case Competition - Executive Assistant  JMSB Management MBA 658 600 Master Case Competition
1470,Strategies in Action (Case Competition)  JMSB Management MBA 659 600 Master Case Competition
1471,Small Business Consulting Bureau  JMSB Management MBA 660 600 Master The Concordia Small Business Consulting Bureau provides professional consulting services start-ups small businesses competitive rates.
1472,SURGICAL INNOVATION II  JMSB Management MBA 662 600 Master This second two courses Surgical Innovation introducing concepts performing needs analyses right exploring entrepreneurial skills needed launch start-up company.
1473,"Introduction to Modern Chinese II  FAS Classics, Modern Languages and Linguistics MCHI 206 200 Bachelor lab work"
1474,"INTERM. MDRN CHINESE I  FAS Classics, Modern Languages and Linguistics MCHI 240 200 Bachelor lab work"
1475,"Intermediate Modern Chinese II  FAS Classics, Modern Languages and Linguistics MCHI 250 200 Bachelor lab work"
1476,"Introduction to Modern Chinese I MCHI200 = MCHI205 FAS Classics, Modern Languages and Linguistics MCHI 200 200 Bachelor lab work"
1477,"Introduction to Modern Chinese I  FAS Classics, Modern Languages and Linguistics MCHI 200 200 Bachelor lab work"
1478,"Mechanical Engineering Drawing MIAE 211 = MECH 211 GCS Mechanical, Industrial and Aerospace Engineering (MIAE) MECH 211 200 Bachelor Laboratory: 2 hours per week, alternate weeks"
1479,"Mechanical Engineering Drawing MIAE 211 = MECH 211 GCS Mechanical, Industrial and Aerospace Engineering (MIAE) MECH 211 200 Bachelor Laboratory: 2 hours per week, alternate weeks"
1480,"Mechanical Engineering Drawing MIAE 211 = MECH 211 GCS Mechanical, Industrial and Aerospace Engineering (MIAE) MECH 211 200 Bachelor Laboratory: 2 hours per week, alternate weeks"
1481,"Programming for Mechanical and Industrial Engineers MIAE 215 = MECH 215 GCS Mechanical, Industrial and Aerospace Engineering (MIAE) MECH 215 200 Bachelor Laboratory: 1 hour per week Using Arduino - type microcontroller board used mechatronics robotics"
1482,"Programming for Mechanical and Industrial Engineers MIAE 215 = MECH 215 GCS Mechanical, Industrial and Aerospace Engineering (MIAE) MECH 215 200 Bachelor Laboratory: 1 hour per week Using Arduino - type microcontroller board used mechatronics robotics"
1483,"Programming for Mechanical and Industrial Engineers MIAE 215 = MECH 215 GCS Mechanical, Industrial and Aerospace Engineering (MIAE) MECH 215 200 Bachelor Laboratory: 1 hour per week Using Arduino - type microcontroller board used mechatronics robotics"
1484,"Manufacturing Processes MIAE 311 = MECH 311 GCS Mechanical, Industrial and Aerospace Engineering (MIAE) MECH 311 300 Bachelor Industrial visits, field trips local industries, Laboratory: 3 hours per week, alternate weeks"
1485,"Manufacturing Processes MIAE 311 = MECH 311 GCS Mechanical, Industrial and Aerospace Engineering (MIAE) MECH 311 300 Bachelor Industrial visits, field trips local industries, Laboratory: 3 hours per week, alternate weeks"
1486,"Manufacturing Processes MIAE 311 = MECH 311 GCS Mechanical, Industrial and Aerospace Engineering (MIAE) MECH 311 300 Bachelor Industrial visits, field trips local industries, Laboratory: 3 hours per week, alternate weeks"
1487,"Properties and Failure of Materials  GCS Mechanical, Industrial and Aerospace Engineering (MIAE) MECH 321 300 Bachelor Laboratory: 2 hours per week, alternate weeks"
1488,"Properties and Failure of Materials  GCS Mechanical, Industrial and Aerospace Engineering (MIAE) MECH 321 300 Bachelor Laboratory: 2 hours per week, alternate weeks"
1489,"Properties and Failure of Materials  GCS Mechanical, Industrial and Aerospace Engineering (MIAE) MECH 321 300 Bachelor Laboratory: 2 hours per week, alternate weeks"
1490,"Theory of Machines  GCS Mechanical, Industrial and Aerospace Engineering (MIAE) MECH 343 300 Bachelor Laboratory: 2 hours per week, alternate weeks"
1491,"Theory of Machines  GCS Mechanical, Industrial and Aerospace Engineering (MIAE) MECH 343 300 Bachelor Laboratory: 2 hours per week, alternate weeks"
1492,"Theory of Machines  GCS Mechanical, Industrial and Aerospace Engineering (MIAE) MECH 343 300 Bachelor Laboratory: 2 hours per week, alternate weeks"
1493,"Thermodynamics II  GCS Mechanical, Industrial and Aerospace Engineering (MIAE) MECH 351 300 Bachelor Laboratory: 2 hours per week, alternate weeks Micro Steam Car Competition: students design & build car powered soda-can water boiler, pin-sized nozzle turbine drives front wheels"
1494,"Thermodynamics II  GCS Mechanical, Industrial and Aerospace Engineering (MIAE) MECH 351 300 Bachelor Laboratory: 2 hours per week, alternate weeks Micro Steam Car Competition: students design & build car powered soda-can water boiler, pin-sized nozzle turbine drives front wheels"
1495,"Thermodynamics II  GCS Mechanical, Industrial and Aerospace Engineering (MIAE) MECH 351 300 Bachelor Laboratory: 2 hours per week, alternate weeks Micro Steam Car Competition: students design & build car powered soda-can water boiler, pin-sized nozzle turbine drives front wheels"
1496,"Heat Transfer I  GCS Mechanical, Industrial and Aerospace Engineering (MIAE) MECH 352 300 Bachelor Laboratory: 2 hours per week, alternate weeks"
1497,"Heat Transfer I  GCS Mechanical, Industrial and Aerospace Engineering (MIAE) MECH 352 300 Bachelor Laboratory: 2 hours per week, alternate weeks"
1498,"Heat Transfer I  GCS Mechanical, Industrial and Aerospace Engineering (MIAE) MECH 352 300 Bachelor Laboratory: 2 hours per week, alternate weeks"
1499,"Fluid Mechanics II  GCS Mechanical, Industrial and Aerospace Engineering (MIAE) MECH 361 300 Bachelor Laboratory: 2 hours per week, alternate weeks"
1500,"Fluid Mechanics II  GCS Mechanical, Industrial and Aerospace Engineering (MIAE) MECH 361 300 Bachelor Laboratory: 2 hours per week, alternate weeks"
1501,"Fluid Mechanics II  GCS Mechanical, Industrial and Aerospace Engineering (MIAE) MECH 361 300 Bachelor Laboratory: 2 hours per week, alternate weeks"
1502,"Electronics for Mechanical Engineers  GCS Mechanical, Industrial and Aerospace Engineering (MIAE) MECH 368 300 Bachelor Laboratory: 2 hours per week, alternate weeks"
1503,"Electronics for Mechanical Engineers  GCS Mechanical, Industrial and Aerospace Engineering (MIAE) MECH 368 300 Bachelor Laboratory: 2 hours per week, alternate weeks"
1504,"Electronics for Mechanical Engineers  GCS Mechanical, Industrial and Aerospace Engineering (MIAE) MECH 368 300 Bachelor Laboratory: 2 hours per week, alternate weeks"
1505,"Modelling and Analysis of Dynamic Systems  GCS Mechanical, Industrial and Aerospace Engineering (MIAE) MECH 370 300 Bachelor Laboratory: 2 hours per week, alternate weeks"
1506,"Modelling and Analysis of Dynamic Systems  GCS Mechanical, Industrial and Aerospace Engineering (MIAE) MECH 370 300 Bachelor Laboratory: 2 hours per week, alternate weeks"
1507,"Modelling and Analysis of Dynamic Systems  GCS Mechanical, Industrial and Aerospace Engineering (MIAE) MECH 370 300 Bachelor Laboratory: 2 hours per week, alternate weeks"
1508,"Analysis and Design of Control Systems ELEC 372 = ENGR 372 GCS Mechanical, Industrial and Aerospace Engineering (MIAE) MECH 371 300 Bachelor Laboratory: 3 hours per week, alternate weeks"
1509,"Analysis and Design of Control Systems ELEC 372 = ENGR 372 GCS Mechanical, Industrial and Aerospace Engineering (MIAE) MECH 371 300 Bachelor Laboratory: 3 hours per week, alternate weeks"
1510,"Analysis and Design of Control Systems ELEC 372 = ENGR 372 GCS Mechanical, Industrial and Aerospace Engineering (MIAE) MECH 371 300 Bachelor Laboratory: 3 hours per week, alternate weeks"
1511,"Mechanical Vibrations MECH 375 = MECH 443 GCS Mechanical, Industrial and Aerospace Engineering (MIAE) MECH 375 300 Bachelor Laboratory: 2 hours per week, alternate weeks"
1512,"Mechanical Vibrations MECH 375 = MECH 443 GCS Mechanical, Industrial and Aerospace Engineering (MIAE) MECH 375 300 Bachelor Laboratory: 2 hours per week, alternate weeks"
1513,"Mechanical Vibrations MECH 375 = MECH 443 GCS Mechanical, Industrial and Aerospace Engineering (MIAE) MECH 375 300 Bachelor Laboratory: 2 hours per week, alternate weeks"
1514,"Mechanical Engineering Design Project  GCS Mechanical, Industrial and Aerospace Engineering (MIAE) MECH 390 300 Bachelor Team-based design project"
1515,"Mechanical Engineering Design Project  GCS Mechanical, Industrial and Aerospace Engineering (MIAE) MECH 390 300 Bachelor Team-based design project"
1516,"Mechanical Engineering Design Project  GCS Mechanical, Industrial and Aerospace Engineering (MIAE) MECH 390 300 Bachelor Team-based design project"
1517,"Computer-Aided Mechanical Design  GCS Mechanical, Industrial and Aerospace Engineering (MIAE) MECH 412 400 Bachelor Laboratory: 2 hours per week, alternate weeks"
1518,"Computer-Aided Mechanical Design  GCS Mechanical, Industrial and Aerospace Engineering (MIAE) MECH 412 400 Bachelor Laboratory: 2 hours per week, alternate weeks"
1519,"Computer Numerically Controlled Machining  GCS Mechanical, Industrial and Aerospace Engineering (MIAE) MECH 414 400 Bachelor Laboratory: 2 hours per week, alternate weeks"
1520,"Computer Numerically Controlled Machining  GCS Mechanical, Industrial and Aerospace Engineering (MIAE) MECH 414 400 Bachelor Laboratory: 2 hours per week, alternate weeks"
1521,"Mechanical Shaping of Metals and Plastics  GCS Mechanical, Industrial and Aerospace Engineering (MIAE) MECH 421 400 Bachelor Laboratory: 2 hours per week, alternate weeks"
1522,"Mechanical Shaping of Metals and Plastics  GCS Mechanical, Industrial and Aerospace Engineering (MIAE) MECH 421 400 Bachelor Laboratory: 2 hours per week, alternate weeks"
1523,"Casting, Welding, Heat Treating, and Non-Destructive Testing  GCS Mechanical, Industrial and Aerospace Engineering (MIAE) MECH 423 400 Bachelor Laboratory: 2 hours per week, alternate weeks"
1524,"Casting, Welding, Heat Treating, and Non-Destructive Testing  GCS Mechanical, Industrial and Aerospace Engineering (MIAE) MECH 423 400 Bachelor Laboratory: 2 hours per week, alternate weeks"
1525,"Casting, Welding, Heat Treating, and Non-Destructive Testing  GCS Mechanical, Industrial and Aerospace Engineering (MIAE) MECH 423 400 Bachelor Laboratory: 2 hours per week, alternate weeks"
1526,"MEMS — Design and Fabrication  GCS Mechanical, Industrial and Aerospace Engineering (MIAE) MECH 424 400 Bachelor Laboratory: 2 hours per week, alternate weeks"
1527,"MEMS — Design and Fabrication  GCS Mechanical, Industrial and Aerospace Engineering (MIAE) MECH 424 400 Bachelor Laboratory: 2 hours per week, alternate weeks"
1528,"Manufacturing of Composites  GCS Mechanical, Industrial and Aerospace Engineering (MIAE) MECH 425 400 Bachelor Simulation, Laboratory: 2 hours per week, alternate weeks"
1529,"Manufacturing of Composites  GCS Mechanical, Industrial and Aerospace Engineering (MIAE) MECH 425 400 Bachelor Simulation, Laboratory: 2 hours per week, alternate weeks"
1530,"Fundamentals of Vehicle System Design  GCS Mechanical, Industrial and Aerospace Engineering (MIAE) MECH 447 400 Bachelor Laboratory: 2 hours per week, alternate weeks"
1531,"Heat Transfer II  GCS Mechanical, Industrial and Aerospace Engineering (MIAE) MECH 452 400 Bachelor Laboratory: 2 hours per week, alternate weeks"
1532,"Heat Transfer II  GCS Mechanical, Industrial and Aerospace Engineering (MIAE) MECH 452 400 Bachelor Laboratory: 2 hours per week, alternate weeks"
1533,"Finite Element Analysis ENGR 460 = MECH 460 GCS Mechanical, Industrial and Aerospace Engineering (MIAE) MECH 460 400 Bachelor Laboratory: 3 hours per week, alternate weeks"
1534,"Finite Element Analysis ENGR 460 = MECH 460 GCS Mechanical, Industrial and Aerospace Engineering (MIAE) MECH 460 400 Bachelor Laboratory: 3 hours per week, alternate weeks"
1535,"Gas Dynamics  GCS Mechanical, Industrial and Aerospace Engineering (MIAE) MECH 461 400 Bachelor Laboratory: 2 hours per week, alternate weeks"
1536,"Gas Dynamics  GCS Mechanical, Industrial and Aerospace Engineering (MIAE) MECH 461 400 Bachelor Laboratory: 2 hours per week, alternate weeks"
1537,"Gas Dynamics  GCS Mechanical, Industrial and Aerospace Engineering (MIAE) MECH 461 400 Bachelor Laboratory: 2 hours per week, alternate weeks"
1538,"Fluid Power Control  GCS Mechanical, Industrial and Aerospace Engineering (MIAE) MECH 463 400 Bachelor Laboratory: 2 hours per week, alternate weeks"
1539,"Fluid Power Control  GCS Mechanical, Industrial and Aerospace Engineering (MIAE) MECH 463 400 Bachelor Laboratory: 2 hours per week, alternate weeks"
1540,"Microcontrollers for Mechatronics  GCS Mechanical, Industrial and Aerospace Engineering (MIAE) MECH 471 400 Bachelor Hands-on project, Laboratory: 2 hours per week, alternate weeks, 3D printer project incorporated"
1541,"Microcontrollers for Mechatronics  GCS Mechanical, Industrial and Aerospace Engineering (MIAE) MECH 471 400 Bachelor Hands-on project, Laboratory: 2 hours per week, alternate weeks, 3D printer project incorporated"
1542,"Mechatronics and Automation  GCS Mechanical, Industrial and Aerospace Engineering (MIAE) MECH 472 400 Bachelor Laboratory: 2 hours per week, alternate weeks"
1543,"Mechatronics and Automation  GCS Mechanical, Industrial and Aerospace Engineering (MIAE) MECH 472 400 Bachelor Laboratory: 2 hours per week, alternate weeks"
1544,"Control System Design ENGR 473 = MECH 473 GCS Mechanical, Industrial and Aerospace Engineering (MIAE) MECH 473 400 Bachelor Lab project, Laboratory: 2 hours per week, alternate weeks, 3D printer project incorporated"
1545,"Control System Design ENGR 473 = MECH 473 GCS Mechanical, Industrial and Aerospace Engineering (MIAE) MECH 473 400 Bachelor Lab project, Laboratory: 2 hours per week, alternate weeks, 3D printer project incorporated"
1546,"Mechatronics  GCS Mechanical, Industrial and Aerospace Engineering (MIAE) MECH 474 400 Bachelor Laboratory: 3 hours per week, alternate weeks"
1547,"Mechatronics  GCS Mechanical, Industrial and Aerospace Engineering (MIAE) MECH 474 400 Bachelor Laboratory: 3 hours per week, alternate weeks"
1548," Capstone Mechanical Engineering Design Project  GCS Mechanical, Industrial and Aerospace Engineering (MIAE) MECH 490A 400 Bachelor design, simulation experimental capstone design project"
1549," Capstone Mechanical Engineering Design Project  GCS Mechanical, Industrial and Aerospace Engineering (MIAE) MECH 490A 400 Bachelor design, simulation experimental capstone design project"
1550,"VIRTUAL SYSTEMS  GCS Mechanical, Industrial and Aerospace Engineering (MIAE) MECH 6041 60000 Master A project required"
1551,"VIRTUAL SYSTEMS  GCS Mechanical, Industrial and Aerospace Engineering (MIAE) MECH 6041 60000 Master A project required"
1552,"KINETIC THEORY OF GASES  GCS Mechanical, Industrial and Aerospace Engineering (MIAE) MECH 6101 60000 Master / Certificate A project specific topic applications required"
1553,"CONDUCT N+RADIA N HEAT TRANS  GCS Mechanical, Industrial and Aerospace Engineering (MIAE) MECH 6131 60000 Master A project selected topics required"
1554,"HEAT EXCHANGER DESIGN  GCS Mechanical, Industrial and Aerospace Engineering (MIAE) MECH 6141 60000 Master A project selected topics required"
1555,"COMBUSTION  GCS Mechanical, Industrial and Aerospace Engineering (MIAE) MECH 6191 60000 Master Projects selected topics required"
1556,"HELICOPTER FLIGHT DYNAMICS  GCS Mechanical, Industrial and Aerospace Engineering (MIAE) MECH 6231 60000 Master / Certificate Case studies projects selected topics required"
1557,"OPERATIONAL PERF./AIRCRAFT  GCS Mechanical, Industrial and Aerospace Engineering (MIAE) MECH 6241 60000 Master / Certificate Projects selected topics required"
1558,"VIBR. PROB. IN ROTAT. MACH.  GCS Mechanical, Industrial and Aerospace Engineering (MIAE) MECH 6301 60000 Master Projects selected applications required"
1559,"NOISE + VIBRATION CONTROL  GCS Mechanical, Industrial and Aerospace Engineering (MIAE) MECH 6311 60000 Master Projects selected applications required"
1560,"OPT. DESIGN OF MECH. SYST.  GCS Mechanical, Industrial and Aerospace Engineering (MIAE) MECH 6321 60000 Master An optimization project selected topics required"
1561,"MODAL ANALYSIS/MECH.SYSTEMS  GCS Mechanical, Industrial and Aerospace Engineering (MIAE) MECH 6351 60000 Master Projects selected applications required"
1562,"MECHANICS+BIOL. TISSUES  GCS Mechanical, Industrial and Aerospace Engineering (MIAE) MECH 6361 60000 Master A project current topic required"
1563,"METAL MACH.+SURFACE TECH.  GCS Mechanical, Industrial and Aerospace Engineering (MIAE) MECH 6421 60000 Master / Certificate A project selected topics required"
1564,"INTRO TO TRIBOLOGY  GCS Mechanical, Industrial and Aerospace Engineering (MIAE) MECH 6431 60000 Master / Certificate A project specific topic applications required"
1565,"STRESS ANALYSIS/MECH DESIGN  GCS Mechanical, Industrial and Aerospace Engineering (MIAE) MECH 6441 60000 Master / Certificate Case studies, project selected applications required"
1566,"COMPUTER-AIDED MECH. DESIGN  GCS Mechanical, Industrial and Aerospace Engineering (MIAE) MECH 6451 60000 Master A project required"
1567,"ENGR METROL & MESRT SYSTEMS  GCS Mechanical, Industrial and Aerospace Engineering (MIAE) MECH 6491 60000 Master A project required"
1568,"ADVANCED MATERIALS  GCS Mechanical, Industrial and Aerospace Engineering (MIAE) MECH 6501 60000 Master / Certificate A project selected topics current interest required"
1569,"CASTING  GCS Mechanical, Industrial and Aerospace Engineering (MIAE) MECH 6531 60000 Master A project current research topic selected applications required"
1570,"CASTING  GCS Mechanical, Industrial and Aerospace Engineering (MIAE) MECH 6531 60000 Master A project current research topic selected applications required"
1571,"JOIN G PROC+NONDESTRUC.TEST.  GCS Mechanical, Industrial and Aerospace Engineering (MIAE) MECH 6541 60000 Master A project current research topic selected applications required"
1572,"FRACTURE  GCS Mechanical, Industrial and Aerospace Engineering (MIAE) MECH 6551 60000 Master A project current research topics selected applications required"
